{
  "candidateId" : "1001",
  "fullName" : "John Smith",
  "primaryEmail" : "john.smith@gmail.com",
  "primaryPhone" : "+919876543210",
  "skills" : [ {
    "name" : "Kubernetes",
    "confidence" : 0.9,
    "sources" : [ "Resume" ]
  }, {
    "name" : "SQL",
    "confidence" : 0.9,
    "sources" : [ "Resume" ]
  }, {
    "name" : "Docker",
    "confidence" : 0.9,
    "sources" : [ "Resume" ]
  }, {
    "name" : "Spring",
    "confidence" : 0.9,
    "sources" : [ "Resume" ]
  }, {
    "name" : "Spring Boot",
    "confidence" : 0.9,
    "sources" : [ "Resume" ]
  }, {
    "name" : "Java",
    "confidence" : 0.9,
    "sources" : [ "Resume" ]
  } ],
  "experience" : [ ],
  "education" : [ ],
  "overall_confidence" : null,
  "provenance" : null
}